{
  "schema": "ever.usage.v1",
  "instance_id": "01JNE7V9J03J6XQ2WN8H0Z88R5",
  "measured_at": "2026-11-02T10:00:00Z",
  "units": [
    {
      "unit": "user",
      "quantity": 17,
      "method": "peak_in_period"
    },
    {
      "unit": "seat",
      "quantity": 12,
      "method": "active_at_measurement"
    }
  ],
  "product_tenant_id": "tenant-1"
}
